<?xml version="1.0" encoding="UTF-8"?>
<test_data xmlns:xsi="http://www.w3.org/2001/XMLSchema-instance"
	xsi:noNamespaceSchemaLocation="dice.xsd">
	<data>
		<sides>1</sides>
		<quantity>0</quantity>
		<modifier>0</modifier>
	</data>
	<data>
		<sides>1</sides>
		<quantity>1</quantity>
		<modifier>0</modifier>
	</data>
	<data>
		<sides>1</sides>
		<quantity>1</quantity>
		<modifier>1</modifier>
	</data>
	<data>
		<sides>1</sides>
		<quantity>1</quantity>
		<modifier>5</modifier>
	</data>
	<data>
		<sides>1</sides>
		<quantity>5</quantity>
		<modifier>0</modifier>
	</data>
	<data>
		<sides>1</sides>
		<quantity>5</quantity>
		<modifier>1</modifier>
	</data>
	<data>
		<sides>1</sides>
		<quantity>5</quantity>
		<modifier>5</modifier>
	</data>
	<data>
		<sides>6</sides>
		<quantity>1</quantity>
		<modifier>0</modifier>
	</data>
	<data>
		<sides>6</sides>
		<quantity>0</quantity>
		<modifier>0</modifier>
	</data>
	<data>
		<sides>6</sides>
		<quantity>1</quantity>
		<modifier>1</modifier>
	</data>
	<data>
		<sides>6</sides>
		<quantity>1</quantity>
		<modifier>3</modifier>
	</data>
	<data>
		<sides>6</sides>
		<quantity>10</quantity>
		<modifier>0</modifier>
	</data>
	<data>
		<sides>6</sides>
		<quantity>10</quantity>
		<modifier>1</modifier>
	</data>
	<data>
		<sides>6</sides>
		<quantity>10</quantity>
		<modifier>3</modifier>
	</data>
	<data>
		<sides>20</sides>
		<quantity>1</quantity>
		<modifier>0</modifier>
	</data>
	<data>
		<sides>20</sides>
		<quantity>0</quantity>
		<modifier>0</modifier>
	</data>
	<data>
		<sides>20</sides>
		<quantity>1</quantity>
		<modifier>1</modifier>
	</data>
	<data>
		<sides>20</sides>
		<quantity>1</quantity>
		<modifier>3</modifier>
	</data>
	<data>
		<sides>20</sides>
		<quantity>10</quantity>
		<modifier>0</modifier>
	</data>
	<data>
		<sides>20</sides>
		<quantity>10</quantity>
		<modifier>1</modifier>
	</data>
	<data>
		<sides>20</sides>
		<quantity>10</quantity>
		<modifier>3</modifier>
	</data>
	<data>
		<sides>100</sides>
		<quantity>1</quantity>
		<modifier>0</modifier>
	</data>
	<data>
		<sides>100</sides>
		<quantity>0</quantity>
		<modifier>0</modifier>
	</data>
	<data>
		<sides>100</sides>
		<quantity>1</quantity>
		<modifier>1</modifier>
	</data>
	<data>
		<sides>100</sides>
		<quantity>1</quantity>
		<modifier>3</modifier>
	</data>
	<data>
		<sides>100</sides>
		<quantity>10</quantity>
		<modifier>0</modifier>
	</data>
	<data>
		<sides>100</sides>
		<quantity>10</quantity>
		<modifier>1</modifier>
	</data>
	<data>
		<sides>100</sides>
		<quantity>10</quantity>
		<modifier>3</modifier>
	</data>
	<data>
		<sides>2147483647</sides>
		<quantity>1</quantity>
		<modifier>0</modifier>
	</data>
	<data>
		<sides>2147483647</sides>
		<quantity>20</quantity>
		<modifier>10</modifier>
	</data>
	<data>
		<sides>2147483647</sides>
		<quantity>20</quantity>
		<modifier>2147483647</modifier>
	</data>
</test_data>